{
  "schemaVersion": "1.0.0",
  "version": 3,
  "language": "en-us",
  "locale": null,
  "narrator": {
    "personaId": "per-explanatory-narrator-en",
    "displayName": "Narrator (male, mascot-aligned)",
    "provider": "local-kokoro",
    "model": "kokoro-v1",
    "voiceId": "am_michael",
    "speakingStyle": "measured explanatory narration; evidence-forward; never announcer-like",
    "prosodyDefaults": {
      "paceIntent": "MODERATE",
      "energy": "BALANCED",
      "pauseStyle": "NATURAL",
      "sentenceFlow": "MEASURED",
      "emphasisStyle": "SELECTIVE",
      "emotionalBaseline": "WARM"
    },
    "speedDefault": 1,
    "pitchDefault": null,
    "energyDefault": "BALANCED",
    "emotionalRange": [
      "NEUTRAL",
      "FRIENDLY",
      "CURIOSITY",
      "CONFIDENT",
      "INSTRUCTIVE"
    ],
    "prohibitedTraits": [
      "UNNATURALLY_SLOW_CINEMATIC",
      "CONSTANT_DRAGMATIC_EMPHASIS",
      "MONOTONE_CADENCE",
      "OVERACTING",
      "ROBOTIC_CLAUSE_RHYTHM",
      "EXCESSIVE_PAUSES",
      "ANNOUNCER_BOMBAST"
    ],
    "persona": {
      "personaId": "per-explanatory-narrator-en",
      "role": "GUIDE",
      "audience": "general viewers who did not know they cared about this topic",
      "tone": "EXPLAINING",
      "energy": "BALANCED",
      "paceIntent": "MODERATE",
      "warmth": "WARM",
      "directness": "BALANCED",
      "formality": "CONVERSATIONAL",
      "storytellingStyle": "EVIDENCE_WALKTHROUGH",
      "emotionalRange": [
        "NEUTRAL",
        "FRIENDLY",
        "CURIOSITY",
        "CONFIDENT",
        "INSTRUCTIVE"
      ],
      "prohibitedDeliveryPatterns": [
        "UNNATURALLY_SLOW_CINEMATIC",
        "CONSTANT_DRAGMATIC_EMPHASIS",
        "MONOTONE_CADENCE",
        "OVERACTING",
        "ROBOTIC_CLAUSE_RHYTHM",
        "EXCESSIVE_PAUSES",
        "ANNOUNCER_BOMBAST"
      ],
      "language": "en-us",
      "notes": "Validation reference persona for Phase 2.1. Segment-level emphasis/pause/energy belongs to Phase 2.2 and must never mutate this identity."
    }
  },
  "characterVoices": [],
  "pronunciationProfileRef": "pron-en-us-reference",
  "providerOptions": null,
  "provenance": {
    "source": "OPERATOR_APPROVED",
    "createdAt": "2026-10-05T15:07:52.665Z",
    "rights": {
      "status": "RISK_ACCEPTED",
      "licenseType": "LICENSED",
      "detail": "Model Apache-2.0 VERIFIED; voice+output RISK_ACCEPTED per operator decision 2026-10-05.",
      "cloning": false
    },
    "evidenceRefs": [
      "providers/license-evidence/local-kokoro.json",
      "projects/phase2-1-validation/evidence/phase-2/2.1/evidence/provider/operator-approval.json",
      "projects/phase2-1-validation/evidence/phase-2/2.1/evidence/provider/voice-selection-and-preview-pack.json",
      "projects/phase2-1-validation/evidence/phase-2/2.1/evidence/provider/narrator-qa-comparison.json"
    ],
    "approvalRef": "projects/phase2-1-validation/evidence/phase-2/2.1/evidence/provider/operator-approval.json"
  },
  "voiceBibleId": "vb-19f4fd6a4596",
  "fingerprint": "37f88895233a26b5"
}
